cwe_id	name	cve_count	avg_score	max_score
1324	DEPRECATED: Sensitive Information Accessible by Physical Probing of JTAG Interface	0	—	—
1330	Remanent Data Readable after Memory Erase	0	—	—
1331	Improper Isolation of Shared Resources in Network On Chip (NoC)	0	—	—
1338	Improper Protections Against Hardware Overheating	0	—	—
1339	Insufficient Precision or Accuracy of a Real Number	0	—	—
1341	Multiple Releases of Same Resource or Handle	0	—	—
1351	Improper Handling of Hardware Behavior in Exceptionally Cold Environments	0	—	—
1429	Missing Security-Relevant Feedback for Unexecuted Operations in Hardware Interface	0	—	—
1431	Driving Intermediate Cryptographic State/Results to Hardware Module Outputs	0	—	—
1434	Insecure Setting of Generative AI/ML Model Inference Parameters	0	—	—
151	Improper Neutralization of Comment Delimiters	0	—	—
152	Improper Neutralization of Macro Symbols	0	—	—
160	Improper Neutralization of Leading Special Elements	0	—	—
161	Improper Neutralization of Multiple Leading Special Elements	0	—	—
163	Improper Neutralization of Multiple Trailing Special Elements	0	—	—
165	Improper Neutralization of Multiple Internal Special Elements	0	—	—
174	Double Decoding of the Same Data	0	—	—
175	Improper Handling of Mixed Encoding	0	—	—
181	Incorrect Behavior Order: Validate Before Filter	0	—	—
206	Observable Internal Behavioral Discrepancy	0	—	—
211	Externally-Generated Error Message Containing Sensitive Information	0	—	—
217	DEPRECATED: Failure to Protect Stored Data from Modification	0	—	—
218	DEPRECATED: Failure to provide confidentiality for stored data	0	—	—
220	Storage of File With Sensitive Data Under FTP Root	0	—	—
221	Information Loss or Omission	0	—	—
222	Truncation of Security-relevant Information	0	—	—
224	Obscured Security-relevant Information by Alternate Name	0	—	—
225	DEPRECATED: General Information Management Problems	0	—	—
238	Improper Handling of Incomplete Structural Elements	0	—	—
243	Creation of chroot Jail Without Changing Working Directory	0	—	—
245	J2EE Bad Practices: Direct Management of Connections	0	—	—
246	J2EE Bad Practices: Direct Use of Sockets	0	—	—
247	DEPRECATED: Reliance on DNS Lookups in a Security Decision	0	—	—
292	DEPRECATED: Trusting Self-reported DNS Name	0	—	—
301	Reflection Attack in an Authentication Protocol	0	—	—
31	Path Traversal: 'dir....filename'	0	—	—
33	Path Traversal: '....' (Multiple Dot)	0	—	—
34	Path Traversal: '....//'	0	—	—
365	DEPRECATED: Race Condition in Switch	0	—	—
370	Missing Check for Certificate Revocation after Initial Check	0	—	—
373	DEPRECATED: State Synchronization Error	0	—	—
374	Passing Mutable Objects to an Untrusted Method	0	—	—
375	Returning a Mutable Object to an Untrusted Caller	0	—	—
382	J2EE Bad Practices: Use of System.exit()	0	—	—
383	J2EE Bad Practices: Direct Use of Threads	0	—	—
386	Symbolic Name not Mapping to Correct Object	0	—	—
39	Path Traversal: 'C:dirname'	0	—	—
397	Declaration of Throws for Generic Exception	0	—	—
423	DEPRECATED: Proxied Trusted Channel	0	—	—
432	Dangerous Signal Handler not Disabled During Sensitive Operations	0	—	—
439	Behavioral Change in New Version or Environment	0	—	—
45	Path Equivalence: 'file...name' (Multiple Internal Dot)	0	—	—
458	DEPRECATED: Incorrect Initialization	0	—	—
464	Addition of Data Structure Sentinel	0	—	—
47	Path Equivalence: ' filename' (Leading Space)	0	—	—
48	Path Equivalence: 'file name' (Internal Whitespace)	0	—	—
481	Assigning instead of Comparing	0	—	—
483	Incorrect Block Delimitation	0	—	—
486	Comparison of Classes by Name	0	—	—
487	Reliance on Package-level Scope	0	—	—
49	Path Equivalence: 'filename/' (Trailing Slash)	0	—	—
491	Public cloneable() Method Without Final ('Object Hijack')	0	—	—
492	Use of Inner Class Containing Sensitive Data	0	—	—
493	Critical Public Variable Without Final Modifier	0	—	—
496	Public Data Assigned to Private Array-Typed Field	0	—	—
498	Cloneable Class Containing Sensitive Information	0	—	—
5	J2EE Misconfiguration: Data Transmission Without Encryption	0	—	—
500	Public Static Field Not Marked Final	0	—	—
508	Non-Replicating Malicious Code	0	—	—
509	Replicating Malicious Code (Virus or Worm)	0	—	—
51	Path Equivalence: '/multiple//internal/slash'	0	—	—
510	Trapdoor	0	—	—
511	Logic/Time Bomb	0	—	—
512	Spyware	0	—	—
516	DEPRECATED: Covert Timing Channel	0	—	—
52	Path Equivalence: '/multiple/trailing/slash//'	0	—	—
53	Path Equivalence: 'multipleinternalbackslash'	0	—	—
535	Exposure of Information Through Shell Error Message	0	—	—
536	Servlet Runtime Error Message Containing Sensitive Information	0	—	—
537	Java Runtime Error Message Containing Sensitive Information	0	—	—
54	Path Equivalence: 'filedir' (Trailing Backslash)	0	—	—
542	DEPRECATED: Information Exposure Through Cleanup Log Files	0	—	—
543	Use of Singleton Pattern Without Synchronization in a Multithreaded Context	0	—	—
545	DEPRECATED: Use of Dynamic Class Loading	0	—	—
546	Suspicious Comment	0	—	—
55	Path Equivalence: '/./' (Single Dot Directory)	0	—	—
554	ASP.NET Misconfiguration: Not Using Input Validation Framework	0	—	—
556	ASP.NET Misconfiguration: Use of Identity Impersonation	0	—	—
558	Use of getlogin() in Multithreaded Application	0	—	—
56	Path Equivalence: 'filedir*' (Wildcard)	0	—	—
560	Use of umask() with chmod-style Argument	0	—	—
568	finalize() Method Without super.finalize()	0	—	—
57	Path Equivalence: 'fakedir/../realdir/filename'	0	—	—
572	Call to Thread run() instead of start()	0	—	—
574	EJB Bad Practices: Use of Synchronization Primitives	0	—	—
575	EJB Bad Practices: Use of AWT Swing	0	—	—
576	EJB Bad Practices: Use of Java I/O	0	—	—
577	EJB Bad Practices: Use of Sockets	0	—	—
578	EJB Bad Practices: Use of Class Loader	0	—	—
579	J2EE Bad Practices: Non-serializable Object Stored in Session	0	—	—
58	Path Equivalence: Windows 8.3 Filename	0	—	—
580	clone() Method Without super.clone()	0	—	—
581	Object Model Violation: Just One of Equals and Hashcode Defined	0	—	—
582	Array Declared Public, Final, and Static	0	—	—
583	finalize() Method Declared Public	0	—	—
584	Return Inside Finally Block	0	—	—
585	Empty Synchronized Block	0	—	—
586	Explicit Call to Finalize()	0	—	—
587	Assignment of a Fixed Address to a Pointer	0	—	—
589	Call to Non-ubiquitous API	0	—	—
593	Authentication Bypass: OpenSSL CTX Object Modified after SSL Objects are Created	0	—	—
594	J2EE Framework: Saving Unserializable Objects to Disk	0	—	—
595	Comparison of Object References Instead of Object Contents	0	—	—
596	DEPRECATED: Incorrect Semantic Object Comparison	0	—	—
6	J2EE Misconfiguration: Insufficient Session-ID Length	0	—	—
607	Public Static Final Field References Mutable Object	0	—	—
608	Struts: Non-private Field in ActionForm Class	0	—	—
609	Double-Checked Locking	0	—	—
619	Dangling Database Cursor ('Cursor Injection')	0	—	—
651	Exposure of WSDL File Containing Sensitive Information	0	—	—
652	Improper Neutralization of Data within XQuery Expressions ('XQuery Injection')	0	—	—
655	Insufficient Psychological Acceptability	0	—	—
666	Operation on Resource in Wrong Phase of Lifetime	0	—	—
685	Function Call With Incorrect Number of Arguments	0	—	—
7	J2EE Misconfiguration: Missing Custom Error Page	0	—	—
71	DEPRECATED: Apple '.DS_Store'	0	—	—
72	Improper Handling of Apple HFS+ Alternate Data Stream Path	0	—	—
764	Multiple Locks of a Critical Resource	0	—	—
766	Critical Data Element Declared Public	0	—	—
773	Missing Reference to Active File Descriptor or Handle	0	—	—
781	Improper Address Validation in IOCTL with METHOD_NEITHER I/O Control Code	0	—	—
785	Use of Path Manipulation Function without Maximum-sized Buffer	0	—	—
793	Only Filtering One Instance of a Special Element	0	—	—
795	Only Filtering Special Elements at a Specified Location	0	—	—
796	Only Filtering Special Elements Relative to a Marker	0	—	—
797	Only Filtering Special Elements at an Absolute Position	0	—	—
8	J2EE Misconfiguration: Entity Bean Declared Remote	0	—	—
806	Buffer Access Using Size of Source Buffer	0	—	—
831	Signal Handler Function Associated with Multiple Signals	0	—	—
832	Unlock of a Resource that is not Locked	0	—	—
9	J2EE Misconfiguration: Weak Access Permissions for EJB Methods	0	—	—
920	Improper Restriction of Power Consumption	0	—	—
